question,A,B,C,D,DapAn,ImageLink
Khi hiệu điện thế đặt vào giữa hai đầu dây dẫn tăng lên ba lần thì cường độ dòng điện qua dây dẫn đó thay đổi như thế nào?,Tăng 3 lần,Không thể xác định chính xác được,Không thay đổi.,Giảm 3 lần.,A,
Trên hình vẽ. Hãy cho biết đồ thị nào biểu diễn đúng mối quan hệ giữa cường độ dòng điện I(A) chạy trong dây dẫn và hiệu điện thế U(V) đặt vào hai đầu dây dẫn đó?,Đồ thị c.,Đồ thị b.,Đồ thị d.,Đồ thị a.,C,question2.jpg
Một dây dẫn được mắc vào hiệu điện thế 9 V thì cường độ dòng điện chạy qua nó là 0.3 A. Nếu giảm hiệu điện thế đặt vào hai đầu dây dẫn đi 3 V thì dòng điện qua dây dẫn khi đó có cường độ như thế nào?,Cường độ dòng điện giảm đi 3 lần.,Cường độ dòng điện tăng lên 3 lần.,Cường độ dòng điện giảm đi 0.2 A.,Cường độ dòng điện là I = 0.2 A.,D,
Hiệu điện thế giữa hai đầu dây dẫn giảm bao nhiêu lần thì cường độ dòng điện chạy qua dây dẫn sẽ, luân phiên tăng giảm,không thay đổi,giảm bấy nhiêu lần,tăng bấy nhiêu lần,C,
Lựa chọn từ thích hợp điền vào chỗ trống.…………. của dây dẫn càng nhỏ thì dây dẫn đó dẫn điện càng tốt.,Điện trở,Chiều dài,Cường độ,Hiệu điện thế,A,
